edital_id,oportunidade_id,orgao,edital_numero,oportunidade_titulo,programa_gestao,inscricao_texto,inscricao_inicio,inscricao_fim,dias_para_encerrar,edital_url,oportunidade_url,email_contato,exigencia_legal,unidade_lotacao,local_atuacao,movimentacao_detalhe,atividades_executadas,jornada_semanal_detalhe,incentivo_gratificacao,quantidade_vagas_detalhe,vinculo_detalhe,permite_estagio_probatorio,residencia_detalhe,orgao_lotacao_detalhe,orgao_exercicio_detalhe,documentacao_detalhe,conhecimentos_tecnicos_obrigatorios,conhecimentos_tecnicos_desejaveis,soft_skills_obrigatorias,soft_skills_desejaveis,idiomas_detalhe,formacao_academica_detalhe,certificacoes_detalhe,outros_cursos_detalhe,experiencias_necessarias,detalhe_texto_integral,erro_coleta_detalhe,edital_pdf_path,edital_pdf_url,edital_pdf_status
6074,10181,ADVOCACIA-GERAL DA UNIÃO,Edital N° 254/2026,GAEG - NÍVEL INTERMEDIÁRIO - COORDENAÇÃO DE EDUCAÇÃO JURÍDICA,Presencial,Inscrição: De 16/03/2026 até o dia 20/03/2026,16/03/2026,20/03/2026,1,https://sougov.sigepe.gov.br/sougov/EditalDetalhe?IdEditalInput=6074,https://sougov.sigepe.gov.br/sougov/OportunidadeDetalhe?IdEditalInput=6074&IdOportunidadeInput=10181,eagu.ceju@agu.gov.br,,Advocacia-Geral da União,,Não Se Aplica,"Gestão e fiscalização das contratações de ações de capacitação; Gestão das etapas de realização das ações de capacitação internas; Atendimento de demandas via e-mail da coordenação; Tratativas com instrutores, alunos, organizadores e empresas; Receber, expedir e solicitar processos e documentos no SuperSapiens; Exercer outras atividades que lhe forem atribuídas pelo Coordenador-Geral e/ou pela Direção-Geral da ESAGU.",40 Horas,GAEG - Nivel Intermediario,1,SERVIDOR PÚBLICO FEDERAL EFETIVO (P. EXECUTIVO),True,,,,Não há exigência de documentação.,Não há obrigatórios,BOA COMUNICAÇÃO ORGANIZAÇÃO MICROSOFT TEAMS OPERAR SISTEMA SUPER SAPIENS PACOTE OFFICE,Não há obrigatórios,Não há desejáveis,Não há requisito de idiomas,Obrigatórios Não há obrigatórios Desejáveis Não há desejáveis,Obrigatórios Não há obrigatórios Desejáveis Não há desejáveis,Obrigatórios Não há obrigatórios Desejáveis Não há desejáveis,DISPONIBILIDADE E PROATIVIDADE PARA O TRABALHO EM EQUIPE E GERENCIAMENTO DE AÇÕES DE CAPACITAÇÃO; AÇÕES DE CAPACITAÇÃO; e BOA REDAÇÃO PARA A ELABORAÇÃO E TRAMITAÇÃO DE DOCUMENTOS ADMINISTRATIVOS;,"Governo Federal Alto Contraste Detalhar Oportunidade Início Solicitações Assistente Edital Nr.254/2026 Advocacia-Geral da União GAEG - NÍVEL INTERMEDIÁRIO - COORDENAÇÃO DE EDUCAÇÃO JURÍDICA Inscrição: De 16/03/2026 até o dia 20/03/2026 Email de Contato: eagu.ceju@agu.gov.br DADOS GERAIS COMPETÊNCIAS FORMAÇÃO EXPERIÊNCIAS Sobre a oportunidade Resumo Gratificação Temporária de Atividade em Escola de Governo (GAEG-NI), valor R$ 2.908,64. Conforme Art. 293 da Lei nº 11.907/2009, o valor da GAEG será ajustado para cada servidor que fizer jus, de modo que a soma da GAEG com a remuneração total do servidor, excluídas as vantagens pessoais e a retribuição devida pelo exercício de cargo ou função comissionada, não seja superior ao valor estabelecido no Anexo CLXIII da Lei nº 11.907/2009. Programa de Gestão: Parcial/Presencial Teletrabalho Parcial (híbrido) para os servidores que já estiverem em exercício na AGU ou Presencial, nos primeiros seis meses, para os que forem de outro órgão ou entidade da Administração Pública Federal direta, Autárquica ou Fundacional (podendo sofrer alterações de acordo com o Programa de Gestão de Desempenho ¿ PGD). Jornada: 40 horas semanais ou conforme o cargo (o valor da gratificação é proporcional à jornada de trabalho, consoante art. 293, §3º, da Lei nº 11.907/2009). Unidade de Lotação Advocacia-Geral da União Local de atuação Movimentação Não Se Aplica Atividades Executadas Gestão e fiscalização das contratações de ações de capacitação; Gestão das etapas de realização das ações de capacitação internas; Atendimento de demandas via e-mail da coordenação; Tratativas com instrutores, alunos, organizadores e empresas; Receber, expedir e solicitar processos e documentos no SuperSapiens; Exercer outras atividades que lhe forem atribuídas pelo Coordenador-Geral e/ou pela Direção-Geral da ESAGU. Programa de Gestão Presencial Jornada Semanal 40 Horas Incentivos Gratificação GAEG - Nivel Intermediario Quantidade de Vagas 1 Requisitos da Oportunidade Vínculo SERVIDOR PÚBLICO FEDERAL EFETIVO (P. EXECUTIVO)Permitido Estágio Probatório Residência Órgão de Lotação Órgão de Exercício Documentação Não há exigência de documentação. Conhecimentos Técnicos Obrigatórios Não há obrigatórios Desejáveis BOA COMUNICAÇÃO ORGANIZAÇÃO MICROSOFT TEAMS OPERAR SISTEMA SUPER SAPIENS PACOTE OFFICE Competências Soft Skills Obrigatórios Não há obrigatórios Desejáveis Não há desejáveis Idiomas Não há requisito de idiomas Acadêmica Obrigatórios Não há obrigatórios Desejáveis Não há desejáveis Certificações Obrigatórios Não há obrigatórios Desejáveis Não há desejáveis Outros Cursos Obrigatórios Não há obrigatórios Desejáveis Não há desejáveis Experiências Necessárias DISPONIBILIDADE E PROATIVIDADE PARA O TRABALHO EM EQUIPE E GERENCIAMENTO DE AÇÕES DE CAPACITAÇÃO; AÇÕES DE CAPACITAÇÃO; e BOA REDAÇÃO PARA A ELABORAÇÃO E TRAMITAÇÃO DE DOCUMENTOS ADMINISTRATIVOS; Quero me Candidatar",,data\editais\edital_6074_Edital_N°_254_2026_edital_oportunidade_22645.pdf,https://sougov.sigepe.gov.br/sougov/EditalDetalhe?IdEditalInput=6074,modal_download_event
6032,10128,AGÊNCIA NACIONAL DE AVIAÇÃO CIVIL,Edital N° 214/2026,JORNALISTA,Parcial,Inscrição: De 04/03/2026 até o dia 20/03/2026,04/03/2026,20/03/2026,1,https://sougov.sigepe.gov.br/sougov/EditalDetalhe?IdEditalInput=6032,https://sougov.sigepe.gov.br/sougov/OportunidadeDetalhe?IdEditalInput=6032&IdOportunidadeInput=10128,gesp@anac.gov.br,,AGENCIA NACIONAL DE AVIACAO CIVIL,Brasília - Distrito Federal,Cessão,Conhecimentos Obrigatórios e Desejáveis: OBRIGATÓRIOS: Domínio da norma culta da língua portuguesa; técnicas de jornalismo; revisão e produção de textos; linguagem simples; produção de conteúdo para redes sociais; atendimento à imprensa; gestão de crise; comunicação interna; excelente habilidade de comunicação; capacidade de interpretação e análise; capacidade de trabalho em equipe; adaptabilidade e capacidade de lidar com prazos apertados; conhecimento das novas tecnologias e mídias digitais. DESEJÁVEIS: Acessibilidade em comunicação; roteirização para vídeo; escrita em inglês; endomarketing; comunicação interna; planejamento estratégico em comunicação; gestão de crises; comunicação estratégica para redes sociais; redação para canais digitais; inteligência artificial aplicada à comunicação; gestão da imagem e reputação; comunicação pública; mensuração de resultados; experiência do usuário; UX writing; gerenciamento de conteúdo do portal gov.br; entre outros.,40 Horas,CCT-0004,1,SERVIDOR PÚBLICO FEDERAL EFETIVO (P. EXECUTIVO)Exceto Estágio Probatório,False,,,,Não há exigência de documentação.,Não há obrigatórios,DOMÍNIO PACOTE OFFICE CONHECIMENTO AMPLO TEAMS HABILIDADES PARA OPERAR NO SISTEMA ELETRÔNICO DE INFORMAÇÃO - SEI,Não há obrigatórios,COMUNICAÇÃO COMUNICAÇÃO ESTRATÉGICA GESTÃO DE CRISES ORIENTAÇÃO POR VALORES ÉTICOS TRABALHO EM EQUIPE,INGLESDesejável Compreensão Fala Escrita Leitura,Obrigatórios Não há obrigatórios Desejáveis Comunicação social - habilitação jornalismo,Obrigatórios Não há obrigatórios Desejáveis Não há desejáveis,Obrigatórios Não há obrigatórios Desejáveis Não há desejáveis,"Experiência:Atendimento à imprensa e gestão de crise. Meses de Experiência: 6 Experiência:Produção de conteúdo para redes sociais. Meses de Experiência: 6 Experiência:Cobertura jornalística e fotográfica. Meses de Experiência: 6 Experiência:Apuração, redação, revisão e produção de conteúdo jornalístico para canais (impressos/digitais) Meses de Experiência: 6 Experiência:Planejamento estratégico e mensuração de resultados em comunicação. Meses de Experiência: 6 Experiência:Produção, filmagem, roteirização e edição de vídeo. Meses de Experiência: 6 Experiência:Coordenação de projetos estratégicos de comunicação. Meses de Experiência: 6 Experiência:Comunicação interna e endomarketing. Meses de Experiência: 6 Outros cursos relevantes (Desejável): Linguagem simples, acessibilidade em comunicação; roteirização para vídeo; escrita em inglês; endomarketing; comunicação interna; planejamento estratégico em comunicação; gestão de crises; comunicação estratégica para redes sociais; redação para canais digitais; inteligência artificial aplicada à comunicação; gestão da imagem e reputação; comunicação pública; mensuração de resultados; experiência do usuário; UX writing; gerenciamento de conteúdo do portal gov.br; entre outros. Pós-graduação (Desejável): Gestão da Comunicação, Planejamento Estratégico, Comunicação Digital, Marketing, Comunicação Pública, Reputação e Imagem, Comunicação Organizacional, Mídias Digitais, Experiência do usuário, Comunicação integrada","Governo Federal Alto Contraste Detalhar Oportunidade Início Solicitações Assistente Edital Nr.214/2026 Agência Nacional de Aviação Civil JORNALISTA Inscrição: De 04/03/2026 até o dia 20/03/2026 Email de Contato: gesp@anac.gov.br DADOS GERAIS COMPETÊNCIAS FORMAÇÃO EXPERIÊNCIAS Sobre a oportunidade Resumo Coordenar e executar planos de comunicação sobre assuntos estratégicos da Anac para diferentes stakeholders; acompanhar, analisar e propor divulgação para pautas relevantes e sensíveis afetas à Anac; atender a imprensa; monitorar e divulgar as pautas deliberadas pela Diretoria Colegiada; produzir e revisar conteúdo para multicanais; realizar cobertura jornalística; colaborar com as atividades de produção, filmagem e roteirização de vídeos; colaborar com a elaboração do Plano de Comunicação Institucional da Anac; participar de reuniões e articular iniciativas da Ascom com diferentes interlocutores internos e externos; planejar ações de comunicação interna; coordenar e executar atividades de comunicação direcionadas às redes sociais; colaborar com levantamentos, mensuração, estudos e diagnósticos em comunicação; participar de equipes de planejamento de contratações públicas para projetos de comunicação; contribuir com iniciativas relacionadas a media training, reputação, inovação e experiência do usuário. Unidade de Lotação AGENCIA NACIONAL DE AVIACAO CIVIL Local de atuação Brasília - Distrito Federal Movimentação Cessão Atividades Executadas Conhecimentos Obrigatórios e Desejáveis: OBRIGATÓRIOS: Domínio da norma culta da língua portuguesa; técnicas de jornalismo; revisão e produção de textos; linguagem simples; produção de conteúdo para redes sociais; atendimento à imprensa; gestão de crise; comunicação interna; excelente habilidade de comunicação; capacidade de interpretação e análise; capacidade de trabalho em equipe; adaptabilidade e capacidade de lidar com prazos apertados; conhecimento das novas tecnologias e mídias digitais. DESEJÁVEIS: Acessibilidade em comunicação; roteirização para vídeo; escrita em inglês; endomarketing; comunicação interna; planejamento estratégico em comunicação; gestão de crises; comunicação estratégica para redes sociais; redação para canais digitais; inteligência artificial aplicada à comunicação; gestão da imagem e reputação; comunicação pública; mensuração de resultados; experiência do usuário; UX writing; gerenciamento de conteúdo do portal gov.br; entre outros. Programa de Gestão Parcial Jornada Semanal 40 Horas Incentivos Gratificação CCT-0004 Quantidade de Vagas 1 Requisitos da Oportunidade Vínculo SERVIDOR PÚBLICO FEDERAL EFETIVO (P. EXECUTIVO)Exceto Estágio Probatório Residência Órgão de Lotação Órgão de Exercício Documentação Não há exigência de documentação. Conhecimentos Técnicos Obrigatórios Não há obrigatórios Desejáveis DOMÍNIO PACOTE OFFICE CONHECIMENTO AMPLO TEAMS HABILIDADES PARA OPERAR NO SISTEMA ELETRÔNICO DE INFORMAÇÃO - SEI Competências Soft Skills Obrigatórios Não há obrigatórios Desejáveis COMUNICAÇÃO COMUNICAÇÃO ESTRATÉGICA GESTÃO DE CRISES ORIENTAÇÃO POR VALORES ÉTICOS TRABALHO EM EQUIPE Idiomas INGLESDesejável Compreensão Fala Escrita Leitura Acadêmica Obrigatórios Não há obrigatórios Desejáveis Comunicação social - habilitação jornalismo Certificações Obrigatórios Não há obrigatórios Desejáveis Não há desejáveis Outros Cursos Obrigatórios Não há obrigatórios Desejáveis Não há desejáveis Experiências Necessárias Experiência:Atendimento à imprensa e gestão de crise. Meses de Experiência: 6 Experiência:Produção de conteúdo para redes sociais. Meses de Experiência: 6 Experiência:Cobertura jornalística e fotográfica. Meses de Experiência: 6 Experiência:Apuração, redação, revisão e produção de conteúdo jornalístico para canais (impressos/digitais) Meses de Experiência: 6 Experiência:Planejamento estratégico e mensuração de resultados em comunicação. Meses de Experiência: 6 Experiência:Produção, filmagem, roteirização e edição de vídeo. Meses de Experiência: 6 Experiência:Coordenação de projetos estratégicos de comunicação. Meses de Experiência: 6 Experiência:Comunicação interna e endomarketing. Meses de Experiência: 6 Outros cursos relevantes (Desejável): Linguagem simples, acessibilidade em comunicação; roteirização para vídeo; escrita em inglês; endomarketing; comunicação interna; planejamento estratégico em comunicação; gestão de crises; comunicação estratégica para redes sociais; redação para canais digitais; inteligência artificial aplicada à comunicação; gestão da imagem e reputação; comunicação pública; mensuração de resultados; experiência do usuário; UX writing; gerenciamento de conteúdo do portal gov.br; entre outros. Pós-graduação (Desejável): Gestão da Comunicação, Planejamento Estratégico, Comunicação Digital, Marketing, Comunicação Pública, Reputação e Imagem, Comunicação Organizacional, Mídias Digitais, Experiência do usuário, Comunicação integrada Quero me Candidatar",,,,botao_pdf_nao_encontrado
