edital_id,oportunidade_id,orgao,edital_numero,oportunidade_titulo,programa_gestao,inscricao_texto,inscricao_inicio,inscricao_fim,dias_para_encerrar,edital_url,oportunidade_url,email_contato,exigencia_legal,unidade_lotacao,local_atuacao,movimentacao_detalhe,atividades_executadas,jornada_semanal_detalhe,incentivo_gratificacao,quantidade_vagas_detalhe,vinculo_detalhe,permite_estagio_probatorio,residencia_detalhe,orgao_lotacao_detalhe,orgao_exercicio_detalhe,documentacao_detalhe,conhecimentos_tecnicos_obrigatorios,conhecimentos_tecnicos_desejaveis,soft_skills_obrigatorias,soft_skills_desejaveis,idiomas_detalhe,formacao_academica_detalhe,certificacoes_detalhe,outros_cursos_detalhe,experiencias_necessarias,detalhe_texto_integral,erro_coleta_detalhe,edital_pdf_path,edital_pdf_url,edital_pdf_status
6084,10193,INSTITUTO NACIONAL DE COLONIZAÇÃO E REFORMA AGRÁRIA,Edital N° 255/2026,GSISP ¿ Transformação Digital (Nível Intermediário),Sem Programa de Gestão,Inscrição: De 11/03/2026 até o dia 25/03/2026,11/03/2026,25/03/2026,6,https://sougov.sigepe.gov.br/sougov/EditalDetalhe?IdEditalInput=6084,https://sougov.sigepe.gov.br/sougov/OportunidadeDetalhe?IdEditalInput=6084&IdOportunidadeInput=10193,coordenacao.tecnologia@incra.gov.br,,Coordenação-Geral de Tecnologia da Informação,Brasília - Distrito Federal,Cessão,"I - Atuar no planejamento, gerenciamento e execução de atividades relacionadas à transformação digital e à governança de TIC, considerando a Estratégia Nacional de Governo Digital e a Estratégia Federal de Governo Digital, em consonância com as diretrizes do INCRA; II ¿ Elaborar, manter e atualizar o Plano Diretor de Tecnologia da Informação e Comunicação (PDTIC) e o Plano de Transformação Digital (PTD); III - Elaborar, manter e atualizar controle de projetos relacionados ao PDTIC e PTD; IV - Atuar em equipes de planejamento de contratação de soluções de TIC; V - Atuar em equipes de gestão e fiscalização de contratos de TIC; VI - Buscar consonância do PDTIC e do PTD com os documentos de governança do INCRA, bem como com a LGPD e o PPSI; VII - Sugerir melhorias nos processos organizacionais, com foco em boas práticas de gestão; VIII - Desenvolver métricas e indicadores de inovação tecnológica e transformação digital, alinhados à cadeia de valor e aos objetivos estratégicos; IX - Realizar atividades de prospecção de serviços aptos a serem contemplados no PDTIC e PTD; X ¿ Representar a instituição junto às iniciativas de integração dos serviços públicos, principalmente à comunidade SISP (Sistema de Administração dos Recursos de Tecnologia da Informação) e ao Ministério da Gestão e Inovação em Serviços Públicos (MGI); XI - Submeter à aprovação, das instâncias necessárias, as políticas, diretrizes e planos relativos à governança de tecnologia da informação e comunicação; XII ¿ Elaborar e acompanhar parcerias e intercâmbios de recursos, informações, tecnologias, produtos e serviços com outros órgãos públicos, empresas públicas e privadas, instituições de pesquisa e desenvolvimento, e demais organizações afins; e, XIII - Desempenhar outras tarefas correlacionadas.",40 Horas,GSISP- Nivel Intermediario,1,Obrigatório SERVIDOR PÚBLICO FEDERAL EFETIVO (P. EXECUTIVO),True,,,,"Há exigência de documentação. Após se candidatar, adicione a documentação exigida.",Não há obrigatórios,GOVERNO DIGITAL ESTRATÉGIA FEDERAL DE GOVERNO DIGITAL PLANO DIRETOR DE TECNOLOGIA DA INFORMAÇÃO PLANO DE TRANSFORMAÇÃO DIGITAL AGIL E SCRUM,Não há obrigatórios,AUTOCONHECIMENTO E DESENVOLVIMENTO PESSOAL COMUNICAÇÃO COMUNICAÇÃO ESTRATÉGICA COORDENAÇÃO E COLABORAÇÃO EM REDE ENGAJAMENTO DE PESSOAS E EQUIPES FOCO NOS RESULTADOS PARA OS CIDADÃOS GERAÇÃO DE VALOR PARA OS USUÁRIOS GESTÃO PARA RESULTADOS INOVAÇÃO E MUDANÇA MENTALIDADE DIGITAL RESOLUÇÃO DE PROBLEMAS COM BASE DE DADOS TRABALHO EM EQUIPE VISÃO DE FUTURO VISÃO SISTÊMICA,Não há requisito de idiomas,Obrigatórios Tecnologia da Informação Transformação Digital ou Gestão da Inovação e Tecnologia ou áreas correlatas Transformação Digital ou Gestão da Inovação e Tecnologia ou áreas correlatas Desejáveis Não há desejáveis,Obrigatórios Não há obrigatórios Desejáveis Não há desejáveis,Obrigatórios Não há obrigatórios Desejáveis Não há desejáveis,Experiência:Tecnologia da Informação Meses de Experiência: 12 Experiência:Gerenciamento de Projetos Meses de Experiência: 3 Experiência:Metodologias ágeis voltadas para inovação ou transformação digital Meses de Experiência: 3 Experiência:Elaboração e/ou gerenciamento de PDTIC Meses de Experiência: 3 Experiência:Elaboração e/ou Gerenciamento de PTD Meses de Experiência: 3,"Governo Federal Alto Contraste Detalhar Oportunidade Início Solicitações Assistente Edital Nr.255/2026 Instituto Nacional de Colonização e Reforma Agrária GSISP ¿ Transformação Digital (Nível Intermediário) Inscrição: De 11/03/2026 até o dia 25/03/2026 Email de Contato: coordenacao.tecnologia@incra.gov.br DADOS GERAIS COMPETÊNCIAS FORMAÇÃO EXPERIÊNCIAS Sobre a oportunidade Resumo A Coordenação -Geral de Tecnologia da Informação - DET, do Instituto Nacional de Colonização e Reforma Agrária - INCRA torna público o processo seletivo simplificado, entre servidores ocupantes de cargos efetivos para concessão de GSISP ¿ Nível Intermediário, para atuação em Transformação Digital da Coordenação-Geral de Tecnologia da Informação - DET. Unidade de Lotação Coordenação-Geral de Tecnologia da Informação Local de atuação Brasília - Distrito Federal Movimentação Cessão Atividades Executadas I - Atuar no planejamento, gerenciamento e execução de atividades relacionadas à transformação digital e à governança de TIC, considerando a Estratégia Nacional de Governo Digital e a Estratégia Federal de Governo Digital, em consonância com as diretrizes do INCRA; II ¿ Elaborar, manter e atualizar o Plano Diretor de Tecnologia da Informação e Comunicação (PDTIC) e o Plano de Transformação Digital (PTD); III - Elaborar, manter e atualizar controle de projetos relacionados ao PDTIC e PTD; IV - Atuar em equipes de planejamento de contratação de soluções de TIC; V - Atuar em equipes de gestão e fiscalização de contratos de TIC; VI - Buscar consonância do PDTIC e do PTD com os documentos de governança do INCRA, bem como com a LGPD e o PPSI; VII - Sugerir melhorias nos processos organizacionais, com foco em boas práticas de gestão; VIII - Desenvolver métricas e indicadores de inovação tecnológica e transformação digital, alinhados à cadeia de valor e aos objetivos estratégicos; IX - Realizar atividades de prospecção de serviços aptos a serem contemplados no PDTIC e PTD; X ¿ Representar a instituição junto às iniciativas de integração dos serviços públicos, principalmente à comunidade SISP (Sistema de Administração dos Recursos de Tecnologia da Informação) e ao Ministério da Gestão e Inovação em Serviços Públicos (MGI); XI - Submeter à aprovação, das instâncias necessárias, as políticas, diretrizes e planos relativos à governança de tecnologia da informação e comunicação; XII ¿ Elaborar e acompanhar parcerias e intercâmbios de recursos, informações, tecnologias, produtos e serviços com outros órgãos públicos, empresas públicas e privadas, instituições de pesquisa e desenvolvimento, e demais organizações afins; e, XIII - Desempenhar outras tarefas correlacionadas. Programa de Gestão Sem Programa de Gestão Jornada Semanal 40 Horas Incentivos Gratificação GSISP- Nivel Intermediario Quantidade de Vagas 1 Requisitos da Oportunidade VínculoObrigatório SERVIDOR PÚBLICO FEDERAL EFETIVO (P. EXECUTIVO)Permitido Estágio Probatório Residência Órgão de Lotação Órgão de Exercício Documentação Há exigência de documentação. Após se candidatar, adicione a documentação exigida. Conhecimentos Técnicos Obrigatórios Não há obrigatórios Desejáveis GOVERNO DIGITAL ESTRATÉGIA FEDERAL DE GOVERNO DIGITAL PLANO DIRETOR DE TECNOLOGIA DA INFORMAÇÃO PLANO DE TRANSFORMAÇÃO DIGITAL AGIL E SCRUM Competências Soft Skills Obrigatórios Não há obrigatórios Desejáveis AUTOCONHECIMENTO E DESENVOLVIMENTO PESSOAL COMUNICAÇÃO COMUNICAÇÃO ESTRATÉGICA COORDENAÇÃO E COLABORAÇÃO EM REDE ENGAJAMENTO DE PESSOAS E EQUIPES FOCO NOS RESULTADOS PARA OS CIDADÃOS GERAÇÃO DE VALOR PARA OS USUÁRIOS GESTÃO PARA RESULTADOS INOVAÇÃO E MUDANÇA MENTALIDADE DIGITAL RESOLUÇÃO DE PROBLEMAS COM BASE DE DADOS TRABALHO EM EQUIPE VISÃO DE FUTURO VISÃO SISTÊMICA Idiomas Não há requisito de idiomas Acadêmica Obrigatórios Tecnologia da Informação Transformação Digital ou Gestão da Inovação e Tecnologia ou áreas correlatas Transformação Digital ou Gestão da Inovação e Tecnologia ou áreas correlatas Desejáveis Não há desejáveis Certificações Obrigatórios Não há obrigatórios Desejáveis Não há desejáveis Outros Cursos Obrigatórios Não há obrigatórios Desejáveis Não há desejáveis Experiências Necessárias Experiência:Tecnologia da Informação Meses de Experiência: 12 Experiência:Gerenciamento de Projetos Meses de Experiência: 3 Experiência:Metodologias ágeis voltadas para inovação ou transformação digital Meses de Experiência: 3 Experiência:Elaboração e/ou gerenciamento de PDTIC Meses de Experiência: 3 Experiência:Elaboração e/ou Gerenciamento de PTD Meses de Experiência: 3 Quero me Candidatar",,,,botao_pdf_nao_encontrado
6091,10200,MINISTÉRIO DA GESTÃO E DA INOVAÇÃO EM SERVIÇOS PÚBLICOS,Edital N° 261/2026,GSISTE de Nível Superior - Aplicação da Legislação,Parcial,Inscrição: De 16/03/2026 até o dia 25/03/2026,16/03/2026,25/03/2026,6,https://sougov.sigepe.gov.br/sougov/EditalDetalhe?IdEditalInput=6091,https://sougov.sigepe.gov.br/sougov/OportunidadeDetalhe?IdEditalInput=6091&IdOportunidadeInput=10200,sgp.decar@gestao.gov.br,"Art. 15 e 16-B da Lei N.º 11.356, de 19 de outubro de 2006. A adesão ao Programa de Gestão e Desempenho - PGD ocorrerá 6 meses após o início do exercício na unidade, conforme estabelecido na Instrução Normativa Conjunta SEGES-SGPRT/MGI nº 24, de 28 de julho de 2023, alterada pela Instrução Normativa Conjunta SEGES-SGPRT/MGI nº 21, de 16 de julho de 2024.",Coordenação-Geral de Aplicação da Legislação de Carreiras,,Cessão,Contribuir em análises e elaborar manifestações para orientação quanto à aplicação da legislação de pessoal relativa aos normativos de competência da Diretoria de Carreiras e Desenvolvimento de Pessoas; Examinar e emitir manifestação técnica sobre propostas de atos normativos e normas complementares relativos a pessoal nos assuntos de competência da Diretoria; Participar de trabalhos para revisão e proposta de consolidação dos atos normativos e das orientações quanto à aplicação da legislação emitidas no âmbito das competências da Diretoria; e Outras atividades administrativas relativas à organização e gestão de documentos produzidos pela área.,40 Horas,GSISTE- Nivel Superior,1,Obrigatório SERVIDOR PÚBLICO FEDERAL EFETIVO (P. EXECUTIVO)Exceto Estágio Probatório,False,,,,Não há exigência de documentação.,Não há obrigatórios,"BOA CAPACIDADE ANALÍTICA, DE ORGANIZAÇÃO E SISTEMATIZAÇÃO DE INFORMAÇÕES CONHECIMENTO E PRÁTICA ACERCA DA LEGISLAÇÃO DE PESSOAL NO ÂMBITO DA ADMINISTRAÇÃO PÚBLICA BOA REDAÇÃO E CAPACIDADE DE CONDUZIR E EXPRESSAR IDEIAS DE MANEIRA CLARA E CONCISA.",Não há obrigatórios,COMUNICAÇÃO VISÃO SISTÊMICA TRABALHO EM EQUIPE,Não há requisito de idiomas,Obrigatórios Não há obrigatórios Desejáveis Não há desejáveis,Obrigatórios Não há obrigatórios Desejáveis Não há desejáveis,Obrigatórios Não há obrigatórios Desejáveis Não há desejáveis,"Experiência:Análise de processos e aplicação da legislação, elaboração de documentos, atos normativos Meses de Experiência: 24 Experiência, formação e certificações relacionadas à gestão de pessoas no poder executivo federal e às competências da unidade serão um diferencial.","Governo Federal Alto Contraste Detalhar Oportunidade Início Solicitações Assistente Edital Nr.261/2026 Ministério da Gestão e da Inovação em Serviços Públicos GSISTE de Nível Superior - Aplicação da Legislação Inscrição: De 16/03/2026 até o dia 25/03/2026 Email de Contato: sgp.decar@gestao.gov.br Exigência Legal: Art. 15 e 16-B da Lei N.º 11.356, de 19 de outubro de 2006. A adesão ao Programa de Gestão e Desempenho - PGD ocorrerá 6 meses após o início do exercício na unidade, conforme estabelecido na Instrução Normativa Conjunta SEGES-SGPRT/MGI nº 24, de 28 de julho de 2023, alterada pela Instrução Normativa Conjunta SEGES-SGPRT/MGI nº 21, de 16 de julho de 2024. DADOS GERAIS COMPETÊNCIAS FORMAÇÃO EXPERIÊNCIAS Sobre a oportunidade Resumo A oportunidade refere-se à concessão da Gratificação Temporária das Unidades Gestoras dos Sistemas Estruturadores da Administração Pública Federal - GSISTE, de nível superior, destinada exclusivamente a servidores públicos federais estáveis, de nível superior, lotados em qualquer órgão ou entidade do Sistema de Pessoal Civil da Administração Federal - Sipec, para atuar na Coordenação-Geral de Aplicação da Legislação de Carreiras - CGALC. Unidade de Lotação Coordenação-Geral de Aplicação da Legislação de Carreiras Local de atuação Movimentação Cessão Atividades Executadas Contribuir em análises e elaborar manifestações para orientação quanto à aplicação da legislação de pessoal relativa aos normativos de competência da Diretoria de Carreiras e Desenvolvimento de Pessoas; Examinar e emitir manifestação técnica sobre propostas de atos normativos e normas complementares relativos a pessoal nos assuntos de competência da Diretoria; Participar de trabalhos para revisão e proposta de consolidação dos atos normativos e das orientações quanto à aplicação da legislação emitidas no âmbito das competências da Diretoria; e Outras atividades administrativas relativas à organização e gestão de documentos produzidos pela área. Programa de Gestão Parcial Jornada Semanal 40 Horas Incentivos Gratificação GSISTE- Nivel Superior Quantidade de Vagas 1 Requisitos da Oportunidade VínculoObrigatório SERVIDOR PÚBLICO FEDERAL EFETIVO (P. EXECUTIVO)Exceto Estágio Probatório Residência Órgão de Lotação Órgão de Exercício Documentação Não há exigência de documentação. Conhecimentos Técnicos Obrigatórios Não há obrigatórios Desejáveis BOA CAPACIDADE ANALÍTICA, DE ORGANIZAÇÃO E SISTEMATIZAÇÃO DE INFORMAÇÕES CONHECIMENTO E PRÁTICA ACERCA DA LEGISLAÇÃO DE PESSOAL NO ÂMBITO DA ADMINISTRAÇÃO PÚBLICA BOA REDAÇÃO E CAPACIDADE DE CONDUZIR E EXPRESSAR IDEIAS DE MANEIRA CLARA E CONCISA. Competências Soft Skills Obrigatórios Não há obrigatórios Desejáveis COMUNICAÇÃO VISÃO SISTÊMICA TRABALHO EM EQUIPE Idiomas Não há requisito de idiomas Acadêmica Obrigatórios Não há obrigatórios Desejáveis Não há desejáveis Certificações Obrigatórios Não há obrigatórios Desejáveis Não há desejáveis Outros Cursos Obrigatórios Não há obrigatórios Desejáveis Não há desejáveis Experiências Necessárias Experiência:Análise de processos e aplicação da legislação, elaboração de documentos, atos normativos Meses de Experiência: 24 Experiência, formação e certificações relacionadas à gestão de pessoas no poder executivo federal e às competências da unidade serão um diferencial. Quero me Candidatar",,,,botao_pdf_nao_encontrado
6112,10240,MINISTÉRIO DAS MULHERES,Edital N° 269/2026,Chefe de Divisão do LIGUE 180 FCE 1.09,Presencial,Inscrição: De 16/03/2026 até o dia 25/03/2026,16/03/2026,25/03/2026,6,https://sougov.sigepe.gov.br/sougov/EditalDetalhe?IdEditalInput=6112,https://sougov.sigepe.gov.br/sougov/OportunidadeDetalhe?IdEditalInput=6112&IdOportunidadeInput=10240,ligue180@mulheres.gov.br,"Para atender o preconizado nos Decretos Nº 11.785, de 20 de novembro de 2023, e Nº 11.443, 21 de março de 2023, a vaga destina-se, preferencialmente, para mulher preta, parda ou indígena.",Coordenação-Geral do Ligue 180,Brasília - Distrito Federal,Cessão,"Elaborar Notas Técnicas sobre as análises realizadas; Implementar e acompanhar rotinas administrativas do Serviço Público; Exercer atividades relacionadas às áreas técnicas e administrativas; Realizar estudos para subsidiar a elaboração de propostas de diretrizes e parâmetros relativos à Politica Nacional de Enfrentamento à Violência; Prospectar e desenvolver estratégias para melhoria contínua dos serviços sob sua responsabilidade; Participar de reuniões relacionadas aso temas da sua competência; Preencher planilhas de controles processuais; Elaborar comunicações internas; Elaborar respostas de solicitações recebidas pelo 180 de órgãos de controle, ou qualquer outra entidade ou cidadão, relativas a política. Desempenhar política institucional; Outras atividades afins.",40 Horas,FCE 1.09,1,Obrigatório SERVIDOR PÚBLICO FEDERAL EFETIVO (P. EXECUTIVO)Exceto Estágio Probatório,False,,,,Não há exigência de documentação.,Não há obrigatórios,Não há desejáveis,Não há obrigatórios,COMUNICAÇÃO AUTOCONHECIMENTO E DESENVOLVIMENTO PESSOAL ÉTICA E INTEGRIDADE PÚBLICA FOCO NOS RESULTADOS PARA OS CIDADÃOS INOVAÇÃO E MUDANÇA ORIENTAÇÃO POR VALORES ÉTICOS TRABALHO EM EQUIPE VISÃO DE FUTURO,Não há requisito de idiomas,Obrigatórios Não há obrigatórios Desejáveis Superior,Obrigatórios Não há obrigatórios Desejáveis Não há desejáveis,Obrigatórios Não há obrigatórios Desejáveis Não há desejáveis,"Experiência:políticas públicas Meses de Experiência: 12 1) Gestão de Processos; 2) Elaboração de Nota Técnica e Pareceres; 3) Gestão de Pessoas (desejável); 4) Pacote OFFICE; EXCEL, WORD e POWER POINT (desejável); e 5) Habilidades para operar no Sistema Eletrônico de Informação - SEI (desejável).","Governo Federal Alto Contraste Detalhar Oportunidade Início Solicitações Assistente Edital Nr.269/2026 Ministério das Mulheres Chefe de Divisão do LIGUE 180 FCE 1.09 Inscrição: De 16/03/2026 até o dia 25/03/2026 Email de Contato: ligue180@mulheres.gov.br Exigência Legal: Para atender o preconizado nos Decretos Nº 11.785, de 20 de novembro de 2023, e Nº 11.443, 21 de março de 2023, a vaga destina-se, preferencialmente, para mulher preta, parda ou indígena. DADOS GERAIS COMPETÊNCIAS FORMAÇÃO EXPERIÊNCIAS Sobre a oportunidade Unidade de Lotação Coordenação-Geral do Ligue 180 Local de atuação Brasília - Distrito Federal Movimentação Cessão Atividades Executadas Elaborar Notas Técnicas sobre as análises realizadas; Implementar e acompanhar rotinas administrativas do Serviço Público; Exercer atividades relacionadas às áreas técnicas e administrativas; Realizar estudos para subsidiar a elaboração de propostas de diretrizes e parâmetros relativos à Politica Nacional de Enfrentamento à Violência; Prospectar e desenvolver estratégias para melhoria contínua dos serviços sob sua responsabilidade; Participar de reuniões relacionadas aso temas da sua competência; Preencher planilhas de controles processuais; Elaborar comunicações internas; Elaborar respostas de solicitações recebidas pelo 180 de órgãos de controle, ou qualquer outra entidade ou cidadão, relativas a política. Desempenhar política institucional; Outras atividades afins. Programa de Gestão Presencial Jornada Semanal 40 Horas Incentivos Gratificação FCE 1.09 Quantidade de Vagas 1 Requisitos da Oportunidade VínculoObrigatório SERVIDOR PÚBLICO FEDERAL EFETIVO (P. EXECUTIVO)Exceto Estágio Probatório Residência Órgão de Lotação Órgão de Exercício Documentação Não há exigência de documentação. Conhecimentos Técnicos Obrigatórios Não há obrigatórios Desejáveis Não há desejáveis Competências Soft Skills Obrigatórios Não há obrigatórios Desejáveis COMUNICAÇÃO AUTOCONHECIMENTO E DESENVOLVIMENTO PESSOAL ÉTICA E INTEGRIDADE PÚBLICA FOCO NOS RESULTADOS PARA OS CIDADÃOS INOVAÇÃO E MUDANÇA ORIENTAÇÃO POR VALORES ÉTICOS TRABALHO EM EQUIPE VISÃO DE FUTURO Idiomas Não há requisito de idiomas Acadêmica Obrigatórios Não há obrigatórios Desejáveis Superior Certificações Obrigatórios Não há obrigatórios Desejáveis Não há desejáveis Outros Cursos Obrigatórios Não há obrigatórios Desejáveis Não há desejáveis Experiências Necessárias Experiência:políticas públicas Meses de Experiência: 12 1) Gestão de Processos; 2) Elaboração de Nota Técnica e Pareceres; 3) Gestão de Pessoas (desejável); 4) Pacote OFFICE; EXCEL, WORD e POWER POINT (desejável); e 5) Habilidades para operar no Sistema Eletrônico de Informação - SEI (desejável). Quero me Candidatar",,,,botao_pdf_nao_encontrado
