edital_id,oportunidade_id,orgao,edital_numero,oportunidade_titulo,programa_gestao,inscricao_texto,inscricao_inicio,inscricao_fim,dias_para_encerrar,edital_url,oportunidade_url,email_contato,exigencia_legal,unidade_lotacao,local_atuacao,movimentacao_detalhe,atividades_executadas,jornada_semanal_detalhe,incentivo_gratificacao,quantidade_vagas_detalhe,vinculo_detalhe,permite_estagio_probatorio,residencia_detalhe,orgao_lotacao_detalhe,orgao_exercicio_detalhe,documentacao_detalhe,conhecimentos_tecnicos_obrigatorios,conhecimentos_tecnicos_desejaveis,soft_skills_obrigatorias,soft_skills_desejaveis,idiomas_detalhe,formacao_academica_detalhe,certificacoes_detalhe,outros_cursos_detalhe,experiencias_necessarias,detalhe_texto_integral,erro_coleta_detalhe,edital_pdf_path,edital_pdf_url,edital_pdf_status
6118,10247,MINISTÉRIO DA GESTÃO E DA INOVAÇÃO EM SERVIÇOS PÚBLICOS,Edital N° 281/2026,"GSISTE Nível Superior, Coordenação-Geral de Governança Organizacional",Parcial,Inscrição: De 16/03/2026 até o dia 30/03/2026,16/03/2026,30/03/2026,11,https://sougov.sigepe.gov.br/sougov/EditalDetalhe?IdEditalInput=6118,https://sougov.sigepe.gov.br/sougov/OportunidadeDetalhe?IdEditalInput=6118&IdOportunidadeInput=10247,aliny.vanzetto@gestao.gov.br,"Nos termos do Decreto nº 11.072, de 17 de maio de 2022, bem como da Instrução Normativa Conjunta SEGES-SGRT/MGI nº 24, de 28 de julho de 2023, alterada pela Instrução Normativa Conjunta SEGES-SGP-SRT/MGI Nº 21 de 16 de julho de 2024 e da Instrução Normativa Conjunta SGP-SRT-SEGES/ MGI nº 52, de 21 de dezembro de 2023. GSISTE: aplicável apenas a algumas carreiras do setor público, e possui limite máximo ajustado à remuneração do(a) servidor(a), nos termos do art. 15 e 16-B da Lei N.º 11.356, de 19 de outubro de 2006.",Coordenação-Geral de Governança Organizacional,Brasília - Distrito Federal,": cessão ou movimentação de força de trabalho, conforme viabilidade e normativos aplicáveis Incentivo: GSISTE Nível Superior Unidade de Lotação Coordenação-Geral de Governança Organizacional Local de atuação Brasília - Distrito Federal Movimentação Cessão","· Assessorar tecnicamente a Coordenação de Modelagem, Monitoramento e Avaliação em Governança (COMAG) nas agendas de governança organizacional do MGI; · Apoiar o acompanhamento da implementação de instâncias, mecanismos e instrumentos de governança no âmbito do Ministério; · Apoiar tecnicamente os colegiados internos e comitês temáticos de governança, inclusive na preparação de pautas, atas, memórias, apresentações e registros; · Contribuir para o planejamento, monitoramento e avaliação de ciclos, planos, agendas, iniciativas e entregas relacionadas à governança organizacional; · Elaborar, consolidar e revisar notas técnicas, relatórios, apresentações executivas, minutas e demais documentos de apoio à governança; · sistematizar informações, evidências e dados gerenciais para subsidiar processos decisórios e a melhoria dos mecanismos de governança; · Apoiar a elaboração, revisão e aperfeiçoamento de planos, políticas, programas, fluxos, orientações e instrumentos relacionados à governança organizacional; · Apoiar o levantamento, consolidação, acompanhamento e análise de indicadores, referenciais e informações institucionais relacionados à governança, gestão e sustentabilidade; · Orientar, quando demandado, unidades organizacionais quanto a padrões técnicos de documentos e registros associados às instâncias de governança; · Apoiar atividades de articulação intersetorial, inclusive em temas transversais relacionados à governança e à integração institucional; · Atuar em atividades administrativas da unidade, incluindo elaboração e tramitação de documentos no SEI, quando necessário.",40 Horas,GSISTE- Nivel Superior,1,SERVIDOR PÚBLICO FEDERAL EFETIVO (P. EXECUTIVO),True,,,,"Há exigência de documentação. Após se candidatar, adicione a documentação exigida.",Não há obrigatórios,Não há desejáveis,Não há obrigatórios,TRABALHO EM EQUIPE VISÃO SISTÊMICA COMUNICAÇÃO ESTRATÉGICA ENGAJAMENTO DE PESSOAS E EQUIPES,Não há requisito de idiomas,Obrigatórios Não há obrigatórios Desejáveis Qualquer área de formação,Obrigatórios Não há obrigatórios Desejáveis Não há desejáveis,Obrigatórios Não há obrigatórios Desejáveis Não há desejáveis,"Para compor o time da COMAG, busca-se profissional com perfil analítico, organizado e colaborativo, com capacidade de transitar entre atividades de assessoramento técnico, sistematização de informações e articulação institucional. Serão especialmente valorizadas as seguintes competências: - visão sistêmica e capacidade de compreender estruturas e fluxos decisórios; - capacidade de planejamento, organização e priorização de demandas; - clareza na comunicação oral e escrita; - capacidade de articulação com diferentes unidades e equipes; - objetividade, rigor técnico e atenção a detalhes; - postura proativa e orientada a resultados; - capacidade de produzir sínteses executivas e apoiar processos decisórios; - compromisso com a melhoria contínua, com o interesse público e com a entrega de valor institucional.","Governo Federal Alto Contraste Detalhar Oportunidade Início Solicitações Assistente Edital Nr.281/2026 Ministério da Gestão e da Inovação em Serviços Públicos GSISTE Nível Superior, Coordenação-Geral de Governança Organizacional Inscrição: De 16/03/2026 até o dia 30/03/2026 Email de Contato: aliny.vanzetto@gestao.gov.br Exigência Legal: Nos termos do Decreto nº 11.072, de 17 de maio de 2022, bem como da Instrução Normativa Conjunta SEGES-SGRT/MGI nº 24, de 28 de julho de 2023, alterada pela Instrução Normativa Conjunta SEGES-SGP-SRT/MGI Nº 21 de 16 de julho de 2024 e da Instrução Normativa Conjunta SGP-SRT-SEGES/ MGI nº 52, de 21 de dezembro de 2023. GSISTE: aplicável apenas a algumas carreiras do setor público, e possui limite máximo ajustado à remuneração do(a) servidor(a), nos termos do art. 15 e 16-B da Lei N.º 11.356, de 19 de outubro de 2006. DADOS GERAIS COMPETÊNCIAS FORMAÇÃO EXPERIÊNCIAS Sobre a oportunidade Resumo GSISTE Nível Superior Unidade Organizacional: Coordenação de Modelagem, Monitoramento e Avaliação em Governança (COMAG) Vagas: 1 Programa de Gestão: teletrabalho parcial Jornada: 40 (quarenta) horas semanais Tipo de Movimentação: cessão ou movimentação de força de trabalho, conforme viabilidade e normativos aplicáveis Incentivo: GSISTE Nível Superior Unidade de Lotação Coordenação-Geral de Governança Organizacional Local de atuação Brasília - Distrito Federal Movimentação Cessão Atividades Executadas · Assessorar tecnicamente a Coordenação de Modelagem, Monitoramento e Avaliação em Governança (COMAG) nas agendas de governança organizacional do MGI; · Apoiar o acompanhamento da implementação de instâncias, mecanismos e instrumentos de governança no âmbito do Ministério; · Apoiar tecnicamente os colegiados internos e comitês temáticos de governança, inclusive na preparação de pautas, atas, memórias, apresentações e registros; · Contribuir para o planejamento, monitoramento e avaliação de ciclos, planos, agendas, iniciativas e entregas relacionadas à governança organizacional; · Elaborar, consolidar e revisar notas técnicas, relatórios, apresentações executivas, minutas e demais documentos de apoio à governança; · sistematizar informações, evidências e dados gerenciais para subsidiar processos decisórios e a melhoria dos mecanismos de governança; · Apoiar a elaboração, revisão e aperfeiçoamento de planos, políticas, programas, fluxos, orientações e instrumentos relacionados à governança organizacional; · Apoiar o levantamento, consolidação, acompanhamento e análise de indicadores, referenciais e informações institucionais relacionados à governança, gestão e sustentabilidade; · Orientar, quando demandado, unidades organizacionais quanto a padrões técnicos de documentos e registros associados às instâncias de governança; · Apoiar atividades de articulação intersetorial, inclusive em temas transversais relacionados à governança e à integração institucional; · Atuar em atividades administrativas da unidade, incluindo elaboração e tramitação de documentos no SEI, quando necessário. Programa de Gestão Parcial Jornada Semanal 40 Horas Incentivos Gratificação GSISTE- Nivel Superior Quantidade de Vagas 1 Requisitos da Oportunidade Vínculo SERVIDOR PÚBLICO FEDERAL EFETIVO (P. EXECUTIVO)Permitido Estágio Probatório Residência Órgão de Lotação Órgão de Exercício Documentação Há exigência de documentação. Após se candidatar, adicione a documentação exigida. Conhecimentos Técnicos Obrigatórios Não há obrigatórios Desejáveis Não há desejáveis Competências Soft Skills Obrigatórios Não há obrigatórios Desejáveis TRABALHO EM EQUIPE VISÃO SISTÊMICA COMUNICAÇÃO ESTRATÉGICA ENGAJAMENTO DE PESSOAS E EQUIPES Idiomas Não há requisito de idiomas Acadêmica Obrigatórios Não há obrigatórios Desejáveis Qualquer área de formação Certificações Obrigatórios Não há obrigatórios Desejáveis Não há desejáveis Outros Cursos Obrigatórios Não há obrigatórios Desejáveis Não há desejáveis Experiências Necessárias Para compor o time da COMAG, busca-se profissional com perfil analítico, organizado e colaborativo, com capacidade de transitar entre atividades de assessoramento técnico, sistematização de informações e articulação institucional. Serão especialmente valorizadas as seguintes competências: - visão sistêmica e capacidade de compreender estruturas e fluxos decisórios; - capacidade de planejamento, organização e priorização de demandas; - clareza na comunicação oral e escrita; - capacidade de articulação com diferentes unidades e equipes; - objetividade, rigor técnico e atenção a detalhes; - postura proativa e orientada a resultados; - capacidade de produzir sínteses executivas e apoiar processos decisórios; - compromisso com a melhoria contínua, com o interesse público e com a entrega de valor institucional. Quero me Candidatar",,,,botao_pdf_nao_encontrado
6124,10255,MINISTÉRIO DAS CIDADES,Edital N° 282/2026,"FCE 4.07 (R$ 2.908,64) - Coordenação de Beneficiários da Secretaria Nacional de Habitação",Parcial,Inscrição: De 18/03/2026 até o dia 30/03/2026,18/03/2026,30/03/2026,11,https://sougov.sigepe.gov.br/sougov/EditalDetalhe?IdEditalInput=6124,https://sougov.sigepe.gov.br/sougov/OportunidadeDetalhe?IdEditalInput=6124&IdOportunidadeInput=10255,dpsm@cidades.gov.br,,Coordenação de Beneficiários,Brasília - Distrito Federal,Cessão,"Atividades a serem executadas: - Assessoramento à Coordenação de Beneficiários; - Gestão das bases de dados e informações do Departamento; - Elaboração de Notas Técnicas, Pareceres e Normativos relacionados ao temas sob gestão da CG; - Acompanhamento de TEDs, Convênios e ACTs.",40 Horas,FCE 4.07,1,Obrigatório SERVIDOR PÚBLICO FEDERAL EFETIVO (P. EXECUTIVO)Exceto Estágio Probatório,False,,,,Não há exigência de documentação.,Não há obrigatórios,POLÍTICAS PÚBLICAS HABITACIONAIS POLÍTICA DE HABITAÇÃO DE INTERESSE SOCIAL ACOMPANHAMENTO DE PROJETOS ACOMPANHAMENTO DE OBRAS ANÁLISE DE BASES DE DADOS ELABORAÇÃO E ANÁLISE DE PLANILHAS,Não há obrigatórios,AUTOCONHECIMENTO E DESENVOLVIMENTO PESSOAL ÉTICA E INTEGRIDADE PÚBLICA GERAÇÃO DE VALOR PARA OS USUÁRIOS GESTÃO PARA RESULTADOS INOVAÇÃO E MUDANÇA MENTALIDADE DIGITAL RESOLUÇÃO DE PROBLEMAS COM BASE DE DADOS TRABALHO EM EQUIPE,Não há requisito de idiomas,Obrigatórios Não há obrigatórios Desejáveis Não há desejáveis,Obrigatórios Não há obrigatórios Desejáveis Não há desejáveis,Obrigatórios Não há obrigatórios Desejáveis Não há desejáveis,"O(a) candidato(a) deve, ainda, comprovar um dos seguintes critérios: a) experiência profissional de, no mínimo, dois anos em atividades correlatas às áreas de atuação do órgão ou da entidade ou em áreas relacionadas às atribuições e às competências do cargo ou da função; b) ocupou cargo em comissão ou função de confiança em qualquer Poder, inclusive na administração pública indireta, de qualquer ente federativo por, no mínimo, dois anos; c) título de especialista, mestre ou doutor em área correlata às áreas de atuação do órgão ou da entidade ou em áreas relacionadas às atribuições do cargo ou da função (anexar comprovante no processo); d) servidor público ocupante de cargo efetivo de nível superior ou militar do círculo hierárquico de oficial ou oficial-general; ou e) ações de desenvolvimento com carga horária mínima acumulada de cento e vinte horas ou obtido certificação profissional em áreas correlatas ao cargo ou à função para o qual tenha sido indicado. Áreas de atuação Obrigatórios Não há obrigatórios Desejáveis APERFEIÇOAMENTO DA GESTÃO PÚBLICA ASSESSORAMENTO DE DIRIGENTES CIÊNCIA, TECNOLOGIA E INOVAÇÃO CONVÊNIOS DESENVOLVIMENTO SOCIAL GESTÃO DA INFORMAÇÃO E DO CONHECIMENTO GESTÃO DE PROCESSOS GESTÃO DE PROJETOS HABITAÇÃO E SANEAMENTO POLÍTICAS PÚBLICAS","Governo Federal Alto Contraste Detalhar Oportunidade Início Solicitações Assistente Edital Nr.282/2026 Ministério das Cidades FCE 4.07 (R$ 2.908,64) - Coordenação de Beneficiários da Secretaria Nacional de Habitação Inscrição: De 18/03/2026 até o dia 30/03/2026 Email de Contato: dpsm@cidades.gov.br DADOS GERAIS COMPETÊNCIAS FORMAÇÃO EXPERIÊNCIAS Sobre a oportunidade Resumo O Ministério das Cidades torna pública a abertura de inscrições para selecionar servidor(a) público(a) efetivo(a) do Poder Executivo Federal, de nível superior, para exercer a função comissionada executiva de Assessor Técnico Especializado, código FCE 4.07, da Coordenação de Beneficiários da Coordenação-Geral de Demandas Sociais do Departamento de Produção Social da Moradia da Secretaria Nacional de Habitação. Possibilidade de execução das atividades na modalidade de teletrabalho, em regime parcial, por meio do Programa de Gestão e Desempenho, em consonância com a Instrução Normativa Conjunta SEGES/MGI nº 24, de 28 de julho de 2023. O(A) servidor(a) irá atuar no desenvolvimento e aprimoramento de políticas habitacionais federais, incluindo a estruturação de bases de dados e fluxos de informação, criação de mecanismos de acompanhamento pós-ocupação de empreendimentos, além da concepção e regulamentação de programas nacionais voltados ao financiamento para melhoria habitacional e à locação social a partir de parque público, com atuação direta no âmbito do Programa Minha Casa, Minha Vida (MCMV). O(A) profissional será responsável por assessorar a Coordenação de Beneficiários, gerir bases de dados e informações do Departamento, elaborar notas técnicas, pareceres e normativos, além de acompanhar TEDs, convênios e acordos de cooperação técnica. Valoriza-se profissional com vontade de aprender, facilidade de relacionamento interpessoal e trabalho em equipe, organização e proatividade, com experiência em análise de processos administrativos e boa capacidade de escrita, especialmente para a elaboração de documentos técnicos, normativos e respostas institucionais, contribuindo para a qualidade e a efetividade das ações desenvolvidas. Também é fundamental o conhecimento de ferramentas de análise de bases de dados e planilhas. Unidade de Lotação Coordenação de Beneficiários Local de atuação Brasília - Distrito Federal Movimentação Cessão Atividades Executadas Atividades a serem executadas: - Assessoramento à Coordenação de Beneficiários; - Gestão das bases de dados e informações do Departamento; - Elaboração de Notas Técnicas, Pareceres e Normativos relacionados ao temas sob gestão da CG; - Acompanhamento de TEDs, Convênios e ACTs. Programa de Gestão Parcial Jornada Semanal 40 Horas Incentivos Gratificação FCE 4.07 Quantidade de Vagas 1 Requisitos da Oportunidade VínculoObrigatório SERVIDOR PÚBLICO FEDERAL EFETIVO (P. EXECUTIVO)Exceto Estágio Probatório Residência Órgão de Lotação Órgão de Exercício Documentação Não há exigência de documentação. Conhecimentos Técnicos Obrigatórios Não há obrigatórios Desejáveis POLÍTICAS PÚBLICAS HABITACIONAIS POLÍTICA DE HABITAÇÃO DE INTERESSE SOCIAL ACOMPANHAMENTO DE PROJETOS ACOMPANHAMENTO DE OBRAS ANÁLISE DE BASES DE DADOS ELABORAÇÃO E ANÁLISE DE PLANILHAS Competências Soft Skills Obrigatórios Não há obrigatórios Desejáveis AUTOCONHECIMENTO E DESENVOLVIMENTO PESSOAL ÉTICA E INTEGRIDADE PÚBLICA GERAÇÃO DE VALOR PARA OS USUÁRIOS GESTÃO PARA RESULTADOS INOVAÇÃO E MUDANÇA MENTALIDADE DIGITAL RESOLUÇÃO DE PROBLEMAS COM BASE DE DADOS TRABALHO EM EQUIPE Idiomas Não há requisito de idiomas Acadêmica Obrigatórios Não há obrigatórios Desejáveis Não há desejáveis Certificações Obrigatórios Não há obrigatórios Desejáveis Não há desejáveis Outros Cursos Obrigatórios Não há obrigatórios Desejáveis Não há desejáveis Experiências Necessárias O(a) candidato(a) deve, ainda, comprovar um dos seguintes critérios: a) experiência profissional de, no mínimo, dois anos em atividades correlatas às áreas de atuação do órgão ou da entidade ou em áreas relacionadas às atribuições e às competências do cargo ou da função; b) ocupou cargo em comissão ou função de confiança em qualquer Poder, inclusive na administração pública indireta, de qualquer ente federativo por, no mínimo, dois anos; c) título de especialista, mestre ou doutor em área correlata às áreas de atuação do órgão ou da entidade ou em áreas relacionadas às atribuições do cargo ou da função (anexar comprovante no processo); d) servidor público ocupante de cargo efetivo de nível superior ou militar do círculo hierárquico de oficial ou oficial-general; ou e) ações de desenvolvimento com carga horária mínima acumulada de cento e vinte horas ou obtido certificação profissional em áreas correlatas ao cargo ou à função para o qual tenha sido indicado. Áreas de atuação Obrigatórios Não há obrigatórios Desejáveis APERFEIÇOAMENTO DA GESTÃO PÚBLICA ASSESSORAMENTO DE DIRIGENTES CIÊNCIA, TECNOLOGIA E INOVAÇÃO CONVÊNIOS DESENVOLVIMENTO SOCIAL GESTÃO DA INFORMAÇÃO E DO CONHECIMENTO GESTÃO DE PROCESSOS GESTÃO DE PROJETOS HABITAÇÃO E SANEAMENTO POLÍTICAS PÚBLICAS Quero me Candidatar",,,,botao_pdf_nao_encontrado
6076,10183,ADVOCACIA-GERAL DA UNIÃO,Edital N° 245/2026,FCE 1.10 - Coordenador COEPE/DPRO,Parcial,Inscrição: De 11/03/2026 até o dia 31/03/2026,11/03/2026,31/03/2026,12,https://sougov.sigepe.gov.br/sougov/EditalDetalhe?IdEditalInput=6076,https://sougov.sigepe.gov.br/sougov/OportunidadeDetalhe?IdEditalInput=6076&IdOportunidadeInput=10183,dpro.assessoria@agu.gov.br,"Este Edital tem sua fundamentação no artigo 20 do Decreto nº 10.829, de 5 de outubro de 2021, e no inciso III do artigo 2º da Instrução Normativa nº 31.",Advocacia-Geral da União,Brasília - Distrito Federal,Não Se Aplica,"Fazer a gestão de dados e da informação, extrair e tratar dados em bancos de dados (ex: SQL Server, PostgreSQL), elaborar painéis interativos (ex: Power BI, Tableau), criar modelos de dados e relatórios gerenciais, garantir a segurança e qualidade das informações, além de automatizar processos de integração de dados (ex: ETL com Pentaho ou scripts Python), sendo essas apenas algumas ferramentas e exemplos que podem variar conforme as necessidades de cada projeto ou instituição. Elaborar indicadores e gerenciar as entregas de pacotes de serviço e de atividades a serem desempenhadas para execução de projetos e atividades; Elaborar planos de execução, comunicação e de acompanhamento de projetos e atividades; Elaborar e acompanhar o cronograma de projetos e atividades; Mapear fluxo das atividades e identificar falhas, a fim de estabelecer estratégias para solução dos problemas; Elaborar propostas de melhoria contínua dos processos; Identificar e acompanhar riscos e realizar reuniões acerca de projetos e atividades; Executar atividades administrativas diversas atinentes ao Planejamento de Pessoas em geral, bem como aos projetos de competência da área, a exemplo do",40 Horas,FCE 1.10,1,Obrigatório SERVIDOR PÚBLICO FEDERAL EFETIVO (P. EXECUTIVO),True,,,,Não há exigência de documentação.,Não há obrigatórios,"MICROSOFT EXCEL - AVANÇADO. POWER BI AVANÇADO PEOPLE ANALYTICS GESTÃO DE PROJETOS PMBOK METODOLOGIA ÁGIL - SCRUM E KANBAN ANÁLISE DE DADOS GESTÃO BASEADA EM EVIDÊNCIAS REDAÇÃO OFICIAL PACOTE OFFICE 365 (EXCEL, WORD, POWERPOINT, OUTLOOK, SHAREPOINT E TEAMS) SIAPE E SIGEPE",Não há obrigatórios,FOCO NOS RESULTADOS PARA OS CIDADÃOS MENTALIDADE DIGITAL ORIENTAÇÃO POR VALORES ÉTICOS RESOLUÇÃO DE PROBLEMAS COM BASE DE DADOS TRABALHO EM EQUIPE,Não há requisito de idiomas,"Obrigatórios Não há obrigatórios Desejáveis em Administração, Engenharia, Gestão de Pessoas ou áreas correlatas",Obrigatórios Não há obrigatórios Desejáveis Não há desejáveis,Obrigatórios Não há obrigatórios Desejáveis Não há desejáveis,"Raciocínio Analítico; Visão Holística; Gerenciamento de Crise; Objetividade; Negociação; Gestão de Mudança; Adaptabilidade; Gerenciamento do Tempo e Autogerenciamento; Alocação Eficiente de Recursos; Atuação nas seguintes áreas: Gestão Estratégica de Pessoas, Programa de Gestão de Desempenho (PGD) e Dimensionamento da Força de Trabalho (DFT).","Governo Federal Alto Contraste Detalhar Oportunidade Início Solicitações Assistente Edital Nr.245/2026 Advocacia-Geral da União FCE 1.10 - Coordenador COEPE/DPRO Inscrição: De 11/03/2026 até o dia 31/03/2026 Email de Contato: dpro.assessoria@agu.gov.br Exigência Legal: Este Edital tem sua fundamentação no artigo 20 do Decreto nº 10.829, de 5 de outubro de 2021, e no inciso III do artigo 2º da Instrução Normativa nº 31. DADOS GERAIS COMPETÊNCIAS FORMAÇÃO EXPERIÊNCIAS Sobre a oportunidade Unidade de Lotação Advocacia-Geral da União Local de atuação Brasília - Distrito Federal Movimentação Não Se Aplica Atividades Executadas Fazer a gestão de dados e da informação, extrair e tratar dados em bancos de dados (ex: SQL Server, PostgreSQL), elaborar painéis interativos (ex: Power BI, Tableau), criar modelos de dados e relatórios gerenciais, garantir a segurança e qualidade das informações, além de automatizar processos de integração de dados (ex: ETL com Pentaho ou scripts Python), sendo essas apenas algumas ferramentas e exemplos que podem variar conforme as necessidades de cada projeto ou instituição. Elaborar indicadores e gerenciar as entregas de pacotes de serviço e de atividades a serem desempenhadas para execução de projetos e atividades; Elaborar planos de execução, comunicação e de acompanhamento de projetos e atividades; Elaborar e acompanhar o cronograma de projetos e atividades; Mapear fluxo das atividades e identificar falhas, a fim de estabelecer estratégias para solução dos problemas; Elaborar propostas de melhoria contínua dos processos; Identificar e acompanhar riscos e realizar reuniões acerca de projetos e atividades; Executar atividades administrativas diversas atinentes ao Planejamento de Pessoas em geral, bem como aos projetos de competência da área, a exemplo do Programa de Gestão e Desempenho e do Dimensionamento da Força de Trabalho. Programa de Gestão Parcial Jornada Semanal 40 Horas Incentivos Gratificação FCE 1.10 Quantidade de Vagas 1 Requisitos da Oportunidade VínculoObrigatório SERVIDOR PÚBLICO FEDERAL EFETIVO (P. EXECUTIVO)Permitido Estágio Probatório Residência Órgão de Lotação Órgão de Exercício Documentação Não há exigência de documentação. Conhecimentos Técnicos Obrigatórios Não há obrigatórios Desejáveis MICROSOFT EXCEL - AVANÇADO. POWER BI AVANÇADO PEOPLE ANALYTICS GESTÃO DE PROJETOS PMBOK METODOLOGIA ÁGIL - SCRUM E KANBAN ANÁLISE DE DADOS GESTÃO BASEADA EM EVIDÊNCIAS REDAÇÃO OFICIAL PACOTE OFFICE 365 (EXCEL, WORD, POWERPOINT, OUTLOOK, SHAREPOINT E TEAMS) SIAPE E SIGEPE Competências Soft Skills Obrigatórios Não há obrigatórios Desejáveis FOCO NOS RESULTADOS PARA OS CIDADÃOS MENTALIDADE DIGITAL ORIENTAÇÃO POR VALORES ÉTICOS RESOLUÇÃO DE PROBLEMAS COM BASE DE DADOS TRABALHO EM EQUIPE Idiomas Não há requisito de idiomas Acadêmica Obrigatórios Não há obrigatórios Desejáveis em Administração, Engenharia, Gestão de Pessoas ou áreas correlatas Certificações Obrigatórios Não há obrigatórios Desejáveis Não há desejáveis Outros Cursos Obrigatórios Não há obrigatórios Desejáveis Não há desejáveis Experiências Necessárias Raciocínio Analítico; Visão Holística; Gerenciamento de Crise; Objetividade; Negociação; Gestão de Mudança; Adaptabilidade; Gerenciamento do Tempo e Autogerenciamento; Alocação Eficiente de Recursos; Atuação nas seguintes áreas: Gestão Estratégica de Pessoas, Programa de Gestão de Desempenho (PGD) e Dimensionamento da Força de Trabalho (DFT). Quero me Candidatar",,,,botao_pdf_nao_encontrado
